{
    "name": "Chamomile",
    "scientific_name": "Matricaria chamomilla",
    "type": "flower",
    "sun": "full",
    "root_depth": "shallow",
    "height": "low",
    "bloom_window": ["May", "July"],
    "companion_plants": ["cabbage", "onion"],
    "antagonistic_plants": [],
    "guild_roles": ["pollinator_draw", "medicinal"],
    "pest_resistance": ["mosquitoes"],
    "uses": ["tea", "calming herb", "pollinator"],
    "notes": "Supports overall plant health. Delicate aroma."
  }
  