{
    "name": "Marigold",
    "scientific_name": "Tagetes patula",
    "type": "flower",
    "sun": "full",
    "root_depth": "shallow",
    "height": "low",
    "bloom_window": ["June", "September"],
    "companion_plants": ["Tomato", "Pepper", "Carrot"],
    "antagonistic_plants": [],
    "guild_roles": ["repellent", "pollinator_draw", "ground_cover"],
    "pest_resistance": ["nematodes", "aphids", "whiteflies"],
    "uses": ["Pollinator Support", "Aesthetic", "Pest Control"],
    "notes": "Marigolds deter root nematodes and flying pests. They attract pollinators and add color to pixel blocks."
  }
  